Monday,Tuesday,Wednesday,Thursday,Friday,Saturday,Sunday,timezone,ID,categories,Rating,Max Rating,Review Count
Open 24 Hours,Open 24 Hours,Open 24 Hours,Open 24 Hours,Open 24 Hours,Open 24 Hours,Open 24 Hours,US/Eastern,0,"Fashion; Food & Drink; Music; Auto, Boat & Air; Health; Sports & Fitness; Film & Media; Community; Government; Travel & Outdoor",5.0,5,2057
Open 24 Hours,Open 24 Hours,Open 24 Hours,Open 24 Hours,Open 24 Hours,Open 24 Hours,Open 24 Hours,US/Eastern,1,"Other; Sports & Fitness; Government; Community; Film & Media; Health; Home & Lifestyle; Food & Drink; Fashion; Charity & Causes; Auto, Boat & Air; Spirituality; Performing & Visual Arts; Science & Tech; Hobbies",2.6,5,284
5:00 AM-10:00 PM,5:00 AM-10:00 PM,5:00 AM-10:00 PM,5:00 AM-10:00 PM,5:00 AM-9:00 PM,6:00 AM-8:00 PM,6:00 AM-8:00 PM,US/Eastern,2,,10.0,10,4526
Open 24 Hours,Open 24 Hours,Open 24 Hours,Open 24 Hours,Open 24 Hours,Open 24 Hours,Open 24 Hours,US/Eastern,3,Film & Media,4.2,5,395
Open 24 Hours,Open 24 Hours,Open 24 Hours,Open 24 Hours,Open 24 Hours,Open 24 Hours,Open 24 Hours,US/Eastern,4,"School Activities; Travel & Outdoor; Hobbies; Film & Media; Community; Government; Health; Home & Lifestyle; Other; Business; Auto, Boat & Air; Performing & Visual Arts; Charity & Causes; Food & Drink; Music; Sports & Fitness; Holidays; Science & Tech; Fashion; Family & Education",10.0,10,2025
Open 24 Hours,Open 24 Hours,Open 24 Hours,Open 24 Hours,Open 24 Hours,Open 24 Hours,Open 24 Hours,US/Eastern,5,Home & Lifestyle; Hobbies; Fashion; Spirituality,4.9,5,1535
5:00 AM-10:00 PM,5:00 AM-10:00 PM,5:00 AM-10:00 PM,5:00 AM-10:00 PM,5:00 AM-9:00 PM,6:00 AM-8:00 PM,6:00 AM-8:00 PM,US/Eastern,6,Music; Sports & Fitness; Performing & Visual Arts; Hobbies; Film & Media; Health; Spirituality; Fashion; School Activities; Science & Tech; Family & Education; Home & Lifestyle,4.9,5,4238
5:00 AM-10:00 PM,5:00 AM-10:00 PM,5:00 AM-10:00 PM,5:00 AM-10:00 PM,5:00 AM-9:00 PM,6:00 AM-8:00 PM,6:00 AM-8:00 PM,US/Eastern,7,Spirituality; Fashion; Other; Home & Lifestyle; Food & Drink; Travel & Outdoor; Business; Film & Media; Performing & Visual Arts; Science & Tech; Family & Education; Government; Community; Health; Charity & Causes; Sports & Fitness; Holidays; Music; School Activities; Hobbies,4.0,5,907
5:00 AM-10:00 PM,5:00 AM-10:00 PM,5:00 AM-10:00 PM,5:00 AM-10:00 PM,5:00 AM-9:00 PM,6:00 AM-8:00 PM,6:00 AM-8:00 PM,US/Eastern,8,,10.0,10,303
Open 24 Hours,Open 24 Hours,Open 24 Hours,Open 24 Hours,Open 24 Hours,Open 24 Hours,Open 24 Hours,US/Eastern,9,Travel & Outdoor; Spirituality; Family & Education; Health; Government; Community; Science & Tech; Other; Hobbies; Holidays; Sports & Fitness,9.6,10,2917
Open 24 Hours,Open 24 Hours,Open 24 Hours,Open 24 Hours,Open 24 Hours,Open 24 Hours,Open 24 Hours,US/Eastern,10,Sports & Fitness; Community; School Activities; Government; Home & Lifestyle; Family & Education; Spirituality,4.4,10,1180
5:00 AM-10:00 PM,5:00 AM-10:00 PM,5:00 AM-10:00 PM,5:00 AM-10:00 PM,5:00 AM-9:00 PM,6:00 AM-8:00 PM,6:00 AM-8:00 PM,US/Eastern,11,"School Activities; Other; Sports & Fitness; Fashion; Auto, Boat & Air; Hobbies; Business; Government; Performing & Visual Arts; Food & Drink",6.2,10,1628
5:00 AM-10:00 PM,5:00 AM-10:00 PM,5:00 AM-10:00 PM,5:00 AM-10:00 PM,5:00 AM-9:00 PM,6:00 AM-8:00 PM,6:00 AM-8:00 PM,US/Eastern,12,"School Activities; Performing & Visual Arts; Fashion; Food & Drink; Sports & Fitness; Spirituality; Home & Lifestyle; Science & Tech; Other; Government; Health; Family & Education; Music; Auto, Boat & Air; Holidays; Community; Hobbies; Film & Media; Business",4.9,5,452
5:00 AM-11:00 PM,5:00 AM-11:00 PM,5:00 AM-11:00 PM,5:00 AM-11:00 PM,5:00 AM-10:00 PM,6:00 AM-8:00 PM,6:00 AM-8:00 PM,US/Eastern,13,"Performing & Visual Arts; Business; Community; Holidays; Sports & Fitness; Home & Lifestyle; Family & Education; Government; Health; Auto, Boat & Air",9.9,10,824
5:00 AM-10:00 PM,5:00 AM-10:00 PM,5:00 AM-10:00 PM,5:00 AM-10:00 PM,5:00 AM-9:00 PM,6:00 AM-8:00 PM,6:00 AM-8:00 PM,US/Eastern,14,"Holidays; Auto, Boat & Air; Family & Education; Home & Lifestyle; Other; Food & Drink; Community; Film & Media; Government; Music",8.7,10,3077
Open 24 Hours,Open 24 Hours,Open 24 Hours,Open 24 Hours,Open 24 Hours,Open 24 Hours,Open 24 Hours,US/Eastern,15,"Government; Science & Tech; Family & Education; Hobbies; Spirituality; Music; School Activities; Community; Performing & Visual Arts; Film & Media; Charity & Causes; Travel & Outdoor; Holidays; Business; Food & Drink; Health; Auto, Boat & Air; Home & Lifestyle",5.0,5,749
Open 24 Hours,Open 24 Hours,Open 24 Hours,Open 24 Hours,Open 24 Hours,Open 24 Hours,Open 24 Hours,US/Eastern,16,Family & Education; Other; Food & Drink; Home & Lifestyle; Business; Health; Spirituality; Science & Tech; Film & Media; Community; Performing & Visual Arts; Charity & Causes,4.1,5,3413
Open 24 Hours,Open 24 Hours,Open 24 Hours,Open 24 Hours,Open 24 Hours,Open 24 Hours,Open 24 Hours,US/Eastern,17,Music,7.6,10,349
Open 24 Hours,Open 24 Hours,Open 24 Hours,Open 24 Hours,Open 24 Hours,Open 24 Hours,Open 24 Hours,US/Eastern,18,Fashion; Spirituality; School Activities; Hobbies; Travel & Outdoor; Community; Music; Sports & Fitness; Health; Film & Media,4.3,5,1708
Open 24 Hours,Open 24 Hours,Open 24 Hours,Open 24 Hours,Open 24 Hours,Open 24 Hours,Open 24 Hours,US/Eastern,19,"Spirituality; Family & Education; Health; Sports & Fitness; Auto, Boat & Air; Holidays; Other",4.7,5,64
5:00 AM-10:00 PM,5:00 AM-10:00 PM,5:00 AM-10:00 PM,5:00 AM-10:00 PM,5:00 AM-9:00 PM,6:00 AM-8:00 PM,6:00 AM-8:00 PM,US/Eastern,20,Science & Tech; Health; Performing & Visual Arts; Business; Travel & Outdoor; Charity & Causes; Hobbies; Sports & Fitness; Other; School Activities; Film & Media; Music; Holidays; Fashion,9.7,10,47
Open 24 Hours,Open 24 Hours,Open 24 Hours,Open 24 Hours,Open 24 Hours,Open 24 Hours,Open 24 Hours,US/Eastern,21,School Activities; Film & Media; Family & Education; Home & Lifestyle; Health; Food & Drink; Other; Travel & Outdoor; Government; Science & Tech; Fashion; Hobbies,4.9,5,1046
5:00 AM-10:00 PM,5:00 AM-10:00 PM,5:00 AM-10:00 PM,5:00 AM-10:00 PM,5:00 AM-9:00 PM,6:00 AM-8:00 PM,6:00 AM-8:00 PM,US/Eastern,22,Health; Sports & Fitness; Film & Media; Government; Other; Travel & Outdoor; Performing & Visual Arts; Charity & Causes; Hobbies; Fashion; Family & Education; Spirituality; Science & Tech; School Activities; Home & Lifestyle; Community; Food & Drink,5.0,5,1585
5:00 AM-10:00 PM,5:00 AM-10:00 PM,5:00 AM-10:00 PM,5:00 AM-10:00 PM,5:00 AM-9:00 PM,6:00 AM-8:00 PM,6:00 AM-8:00 PM,US/Eastern,23,Health; Food & Drink,9.6,10,1
5:00 AM-10:00 PM,5:00 AM-10:00 PM,5:00 AM-10:00 PM,5:00 AM-10:00 PM,5:00 AM-9:00 PM,6:00 AM-8:00 PM,6:00 AM-8:00 PM,US/Eastern,24,"Music; Health; Food & Drink; Hobbies; Other; Business; Home & Lifestyle; School Activities; Travel & Outdoor; Film & Media; Performing & Visual Arts; Family & Education; Auto, Boat & Air; Fashion",8.9,10,2976
5:00 AM-10:00 PM,5:00 AM-10:00 PM,5:00 AM-10:00 PM,5:00 AM-10:00 PM,5:00 AM-9:00 PM,6:00 AM-8:00 PM,6:00 AM-8:00 PM,US/Eastern,25,Government; Spirituality; Food & Drink; Business; Sports & Fitness; Community; Hobbies; Holidays; Travel & Outdoor; Music,4.5,5,978
5:00 AM-10:00 PM,5:00 AM-10:00 PM,5:00 AM-10:00 PM,5:00 AM-10:00 PM,5:00 AM-9:00 PM,6:00 AM-8:00 PM,6:00 AM-8:00 PM,US/Eastern,26,"Hobbies; Charity & Causes; Food & Drink; Community; School Activities; Fashion; Film & Media; Performing & Visual Arts; Science & Tech; Family & Education; Music; Health; Government; Auto, Boat & Air; Travel & Outdoor; Holidays; Spirituality",8.9,10,247
Open 24 Hours,Open 24 Hours,Open 24 Hours,Open 24 Hours,Open 24 Hours,Open 24 Hours,Open 24 Hours,US/Eastern,27,Other; Music; Hobbies; Charity & Causes; Film & Media; Spirituality; Family & Education; Business; Performing & Visual Arts,7.3,10,1557
5:00 AM-10:00 PM,5:00 AM-10:00 PM,5:00 AM-10:00 PM,5:00 AM-10:00 PM,5:00 AM-9:00 PM,6:00 AM-8:00 PM,6:00 AM-8:00 PM,US/Eastern,28,School Activities; Travel & Outdoor; Other; Spirituality; Hobbies; Home & Lifestyle; Community; Holidays; Music,4.7,5,1243
5:00 AM-10:00 PM,5:00 AM-10:00 PM,5:00 AM-10:00 PM,5:00 AM-10:00 PM,5:00 AM-9:00 PM,6:00 AM-8:00 PM,6:00 AM-8:00 PM,US/Eastern,29,Business; Other; Performing & Visual Arts,9.7,10,868
5:00 AM-10:00 PM,5:00 AM-10:00 PM,5:00 AM-10:00 PM,5:00 AM-10:00 PM,5:00 AM-9:00 PM,6:00 AM-8:00 PM,6:00 AM-8:00 PM,US/Eastern,30,"Sports & Fitness; Holidays; Health; Business; Food & Drink; Performing & Visual Arts; School Activities; Family & Education; Auto, Boat & Air; Fashion; Government; Home & Lifestyle; Other",4.5,5,1560
Open 24 Hours,Open 24 Hours,Open 24 Hours,Open 24 Hours,Open 24 Hours,Open 24 Hours,Open 24 Hours,US/Eastern,31,"Hobbies; Holidays; Fashion; Auto, Boat & Air; Music; Spirituality; Business; Government; Home & Lifestyle; School Activities; Performing & Visual Arts; Travel & Outdoor; Charity & Causes; Science & Tech; Other; Community; Film & Media",8.8,10,2069
5:00 AM-10:00 PM,5:00 AM-10:00 PM,5:00 AM-10:00 PM,5:00 AM-10:00 PM,5:00 AM-9:00 PM,6:00 AM-8:00 PM,6:00 AM-8:00 PM,US/Eastern,32,Home & Lifestyle; Sports & Fitness; Spirituality; Fashion; Holidays,8.9,10,1508
5:00 AM-10:00 PM,5:00 AM-10:00 PM,5:00 AM-10:00 PM,5:00 AM-10:00 PM,5:00 AM-9:00 PM,6:00 AM-8:00 PM,6:00 AM-8:00 PM,US/Eastern,33,"Spirituality; Home & Lifestyle; Sports & Fitness; Holidays; Government; Hobbies; Auto, Boat & Air; Community; Food & Drink; Music; Health; Science & Tech; Family & Education; Travel & Outdoor; Film & Media; Charity & Causes",9.9,10,429
Open 24 Hours,Open 24 Hours,Open 24 Hours,Open 24 Hours,Open 24 Hours,Open 24 Hours,Open 24 Hours,US/Eastern,34,"Business; Sports & Fitness; Health; Charity & Causes; Science & Tech; School Activities; Holidays; Other; Government; Fashion; Family & Education; Auto, Boat & Air; Hobbies; Food & Drink; Community; Spirituality; Travel & Outdoor; Home & Lifestyle",8.0,10,52
Open 24 Hours,Open 24 Hours,Open 24 Hours,Open 24 Hours,Open 24 Hours,Open 24 Hours,Open 24 Hours,US/Eastern,35,Community; Travel & Outdoor; Spirituality; Film & Media; Family & Education; Other; Holidays; Business; Fashion,8.0,10,377
5:00 AM-10:00 PM,5:00 AM-10:00 PM,5:00 AM-10:00 PM,5:00 AM-10:00 PM,5:00 AM-9:00 PM,6:00 AM-8:00 PM,6:00 AM-8:00 PM,US/Eastern,36,Film & Media; Holidays; Hobbies; Government; Food & Drink; Charity & Causes; Family & Education; Other; Performing & Visual Arts; Community; Health; Fashion,9.8,10,399
5:00 AM-10:00 PM,5:00 AM-10:00 PM,5:00 AM-10:00 PM,5:00 AM-10:00 PM,5:00 AM-9:00 PM,6:00 AM-8:00 PM,6:00 AM-8:00 PM,US/Eastern,37,Film & Media; Sports & Fitness; Spirituality; Hobbies,5.0,5,890
5:00 AM-10:00 PM,5:00 AM-10:00 PM,5:00 AM-10:00 PM,5:00 AM-10:00 PM,5:00 AM-9:00 PM,6:00 AM-8:00 PM,6:00 AM-8:00 PM,US/Eastern,38,"Community; Auto, Boat & Air; Spirituality; Business; School Activities",9.3,10,676
5:00 AM-10:00 PM,5:00 AM-10:00 PM,5:00 AM-10:00 PM,5:00 AM-10:00 PM,5:00 AM-9:00 PM,6:00 AM-8:00 PM,6:00 AM-8:00 PM,US/Eastern,39,"Family & Education; Auto, Boat & Air; Charity & Causes; Music; Sports & Fitness; Hobbies; Spirituality; Film & Media; Science & Tech; Performing & Visual Arts; Fashion; Community; Government; Other; Travel & Outdoor; Food & Drink; Business; Health; Home & Lifestyle; Holidays; School Activities",10.0,10,4068
Open 24 Hours,Open 24 Hours,Open 24 Hours,Open 24 Hours,Open 24 Hours,Open 24 Hours,Open 24 Hours,US/Eastern,40,"Hobbies; Fashion; Sports & Fitness; Government; Travel & Outdoor; Spirituality; Food & Drink; Auto, Boat & Air; Health; Film & Media; Charity & Causes; Community; Other; Family & Education",4.0,5,1175
Open 24 Hours,Open 24 Hours,Open 24 Hours,Open 24 Hours,Open 24 Hours,Open 24 Hours,Open 24 Hours,US/Eastern,41,"Music; Business; Fashion; Auto, Boat & Air; Family & Education; Performing & Visual Arts; School Activities; Science & Tech; Hobbies; Other; Charity & Causes; Health; Film & Media; Food & Drink; Government; Spirituality; Sports & Fitness; Community; Holidays",4.6,5,778
5:00 AM-10:00 PM,5:00 AM-10:00 PM,5:00 AM-10:00 PM,5:00 AM-10:00 PM,5:00 AM-9:00 PM,6:00 AM-8:00 PM,6:00 AM-8:00 PM,US/Eastern,42,"School Activities; Music; Travel & Outdoor; Family & Education; Home & Lifestyle; Science & Tech; Health; Spirituality; Performing & Visual Arts; Government; Hobbies; Film & Media; Auto, Boat & Air; Food & Drink; Sports & Fitness; Other; Business; Holidays; Fashion; Community",8.9,10,1129
Open 24 Hours,Open 24 Hours,Open 24 Hours,Open 24 Hours,Open 24 Hours,Open 24 Hours,Open 24 Hours,US/Eastern,43,"Auto, Boat & Air; Charity & Causes; Community; Performing & Visual Arts; Business",1.8,10,12
5:00 AM-10:00 PM,5:00 AM-10:00 PM,5:00 AM-10:00 PM,5:00 AM-10:00 PM,5:00 AM-9:00 PM,6:00 AM-8:00 PM,6:00 AM-8:00 PM,US/Eastern,44,School Activities; Government; Home & Lifestyle; Other; Hobbies; Family & Education; Fashion; Holidays; Science & Tech; Music; Business; Food & Drink; Performing & Visual Arts; Sports & Fitness; Film & Media,9.1,10,2110
5:00 AM-10:00 PM,5:00 AM-10:00 PM,5:00 AM-10:00 PM,5:00 AM-10:00 PM,5:00 AM-9:00 PM,6:00 AM-8:00 PM,6:00 AM-8:00 PM,US/Eastern,45,"Community; Spirituality; Hobbies; Government; Home & Lifestyle; Performing & Visual Arts; Business; Film & Media; Food & Drink; Travel & Outdoor; Health; Holidays; Auto, Boat & Air; Charity & Causes; Sports & Fitness; Science & Tech; Music",4.2,5,906
5:00 AM-10:00 PM,5:00 AM-10:00 PM,5:00 AM-10:00 PM,5:00 AM-10:00 PM,5:00 AM-9:00 PM,6:00 AM-8:00 PM,6:00 AM-8:00 PM,US/Eastern,46,Other; Sports & Fitness; Science & Tech,9.7,10,5
5:00 AM-10:00 PM,5:00 AM-10:00 PM,5:00 AM-10:00 PM,5:00 AM-10:00 PM,5:00 AM-9:00 PM,6:00 AM-8:00 PM,6:00 AM-8:00 PM,US/Eastern,47,"Auto, Boat & Air; Travel & Outdoor; School Activities; Community; Food & Drink; Other; Science & Tech; Film & Media; Holidays",4.4,5,1808
6:00 AM-8:00 PM,6:00 AM-8:00 PM,6:00 AM-8:00 PM,6:00 AM-8:00 PM,6:00 AM-8:00 PM,6:00 AM-8:00 PM,6:00 AM-8:00 PM,US/Eastern,48,"Travel & Outdoor; Music; School Activities; Food & Drink; Auto, Boat & Air; Government; Hobbies",9.9,10,963
Open 24 Hours,Open 24 Hours,Open 24 Hours,Open 24 Hours,Open 24 Hours,Open 24 Hours,Open 24 Hours,US/Eastern,49,"Health; Community; Auto, Boat & Air; Spirituality; Fashion; Hobbies; Family & Education; Sports & Fitness; School Activities; Home & Lifestyle; Science & Tech; Business",6.5,10,4304
Open 24 Hours,Open 24 Hours,Open 24 Hours,Open 24 Hours,Open 24 Hours,Open 24 Hours,Open 24 Hours,US/Eastern,50,Other; Travel & Outdoor; Charity & Causes; Holidays; Hobbies; Food & Drink; Sports & Fitness,9.8,10,1200
5:00 AM-10:00 PM,5:00 AM-10:00 PM,5:00 AM-10:00 PM,5:00 AM-10:00 PM,5:00 AM-9:00 PM,6:00 AM-8:00 PM,6:00 AM-8:00 PM,US/Eastern,51,"Performing & Visual Arts; Food & Drink; Auto, Boat & Air; Family & Education; Community; Holidays; Fashion; Business; Hobbies; Music; School Activities; Charity & Causes; Spirituality; Other; Science & Tech; Health; Travel & Outdoor",3.9,5,1707
5:00 AM-10:00 PM,5:00 AM-10:00 PM,5:00 AM-10:00 PM,5:00 AM-10:00 PM,5:00 AM-9:00 PM,6:00 AM-8:00 PM,6:00 AM-8:00 PM,US/Eastern,52,"Performing & Visual Arts; Food & Drink; Music; Other; School Activities; Charity & Causes; Sports & Fitness; Holidays; Family & Education; Film & Media; Business; Hobbies; Auto, Boat & Air; Government; Community",10.0,10,4294
Open 24 Hours,Open 24 Hours,Open 24 Hours,Open 24 Hours,Open 24 Hours,Open 24 Hours,Open 24 Hours,US/Eastern,53,"Fashion; Music; Business; Home & Lifestyle; Government; Film & Media; Travel & Outdoor; Community; Sports & Fitness; Health; School Activities; Holidays; Other; Spirituality; Auto, Boat & Air; Charity & Causes; Hobbies; Performing & Visual Arts; Food & Drink; Family & Education; Science & Tech",4.9,5,529
5:00 AM-10:00 PM,5:00 AM-10:00 PM,5:00 AM-10:00 PM,5:00 AM-10:00 PM,5:00 AM-9:00 PM,6:00 AM-8:00 PM,6:00 AM-8:00 PM,US/Eastern,54,"Food & Drink; Family & Education; Other; Performing & Visual Arts; Fashion; Spirituality; Music; Charity & Causes; Auto, Boat & Air; Home & Lifestyle; Film & Media; Science & Tech; Travel & Outdoor; Government; Business; School Activities; Holidays; Community; Sports & Fitness",3.8,5,225
5:00 AM-10:00 PM,5:00 AM-10:00 PM,5:00 AM-10:00 PM,5:00 AM-10:00 PM,5:00 AM-9:00 PM,6:00 AM-8:00 PM,6:00 AM-8:00 PM,US/Eastern,55,"Home & Lifestyle; Performing & Visual Arts; Auto, Boat & Air; Other; Travel & Outdoor; Hobbies; Government",6.2,10,51
Open 24 Hours,Open 24 Hours,Open 24 Hours,Open 24 Hours,Open 24 Hours,Open 24 Hours,Open 24 Hours,US/Eastern,56,Business,4.9,5,604
Open 24 Hours,Open 24 Hours,Open 24 Hours,Open 24 Hours,Open 24 Hours,Open 24 Hours,Open 24 Hours,US/Eastern,57,"Auto, Boat & Air; Travel & Outdoor; Charity & Causes; Science & Tech; Business; Health; Performing & Visual Arts; Community; Spirituality; School Activities; Other; Government",5.0,5,1969
5:00 AM-10:00 PM,5:00 AM-10:00 PM,5:00 AM-10:00 PM,5:00 AM-10:00 PM,5:00 AM-9:00 PM,6:00 AM-8:00 PM,6:00 AM-8:00 PM,US/Eastern,58,"Spirituality; Charity & Causes; Community; Science & Tech; Home & Lifestyle; Fashion; Travel & Outdoor; Food & Drink; Family & Education; Business; Health; Music; Hobbies; Film & Media; Sports & Fitness; Performing & Visual Arts; Auto, Boat & Air; Government",7.1,10,4010
5:00 AM-10:00 PM,5:00 AM-10:00 PM,5:00 AM-10:00 PM,5:00 AM-10:00 PM,5:00 AM-9:00 PM,6:00 AM-8:00 PM,6:00 AM-8:00 PM,US/Eastern,59,Hobbies,10.0,10,223
5:00 AM-11:00 PM,5:00 AM-11:00 PM,5:00 AM-11:00 PM,5:00 AM-11:00 PM,5:00 AM-11:00 PM,5:00 AM-11:00 PM,5:00 AM-11:00 PM,US/Eastern,60,"Sports & Fitness; Government; Holidays; Travel & Outdoor; Hobbies; Music; Other; Charity & Causes; Film & Media; Auto, Boat & Air; School Activities; Performing & Visual Arts; Food & Drink; Fashion; Home & Lifestyle; Family & Education; Science & Tech; Community; Health",9.3,10,89
5:00 AM-10:00 PM,5:00 AM-10:00 PM,5:00 AM-10:00 PM,5:00 AM-10:00 PM,5:00 AM-9:00 PM,6:00 AM-8:00 PM,6:00 AM-8:00 PM,US/Eastern,61,"Health; Holidays; Auto, Boat & Air; Science & Tech; Spirituality; Community; School Activities; Charity & Causes; Fashion; Hobbies; Sports & Fitness",4.9,5,2989
5:00 AM-10:00 PM,5:00 AM-10:00 PM,5:00 AM-10:00 PM,5:00 AM-10:00 PM,5:00 AM-9:00 PM,6:00 AM-8:00 PM,6:00 AM-8:00 PM,US/Eastern,62,"Other; Spirituality; Film & Media; Family & Education; Science & Tech; Hobbies; Travel & Outdoor; Food & Drink; Charity & Causes; School Activities; Music; Government; Home & Lifestyle; Fashion; Community; Business; Auto, Boat & Air",5.0,5,2489
Open 24 Hours,Open 24 Hours,Open 24 Hours,Open 24 Hours,Open 24 Hours,Open 24 Hours,Open 24 Hours,US/Eastern,63,"Community; Auto, Boat & Air; Government; Music",4.7,5,1651
Open 24 Hours,Open 24 Hours,Open 24 Hours,Open 24 Hours,Open 24 Hours,Open 24 Hours,Open 24 Hours,US/Eastern,64,Health; School Activities; Sports & Fitness,9.8,10,552
5:00 AM-10:00 PM,5:00 AM-10:00 PM,5:00 AM-10:00 PM,5:00 AM-10:00 PM,5:00 AM-9:00 PM,6:00 AM-8:00 PM,6:00 AM-8:00 PM,US/Eastern,65,Music,9.7,10,721
Open 24 Hours,Open 24 Hours,Open 24 Hours,Open 24 Hours,Open 24 Hours,Open 24 Hours,Open 24 Hours,US/Eastern,66,Health; Charity & Causes,8.4,10,2165
5:00 AM-10:00 PM,5:00 AM-10:00 PM,5:00 AM-10:00 PM,5:00 AM-10:00 PM,5:00 AM-9:00 PM,6:00 AM-8:00 PM,6:00 AM-8:00 PM,US/Eastern,67,"School Activities; Hobbies; Other; Holidays; Fashion; Family & Education; Sports & Fitness; Performing & Visual Arts; Spirituality; Health; Science & Tech; Business; Community; Government; Food & Drink; Travel & Outdoor; Music; Auto, Boat & Air; Film & Media",3.6,5,334
5:00 AM-10:00 PM,5:00 AM-10:00 PM,5:00 AM-10:00 PM,5:00 AM-10:00 PM,5:00 AM-9:00 PM,6:00 AM-8:00 PM,6:00 AM-8:00 PM,US/Eastern,68,"Family & Education; Home & Lifestyle; School Activities; Spirituality; Auto, Boat & Air; Other; Performing & Visual Arts; Holidays; Food & Drink",9.2,10,284
Open 24 Hours,Open 24 Hours,Open 24 Hours,Open 24 Hours,Open 24 Hours,Open 24 Hours,Open 24 Hours,US/Eastern,69,"Science & Tech; Health; Auto, Boat & Air; Government; Music; Charity & Causes; Community; Fashion; Business; Spirituality; Sports & Fitness; Holidays; Hobbies; Home & Lifestyle; Food & Drink; Other; Film & Media; Travel & Outdoor",6.9,10,1281
5:00 AM-10:00 PM,5:00 AM-10:00 PM,5:00 AM-10:00 PM,5:00 AM-10:00 PM,5:00 AM-9:00 PM,6:00 AM-8:00 PM,6:00 AM-8:00 PM,US/Eastern,70,"Auto, Boat & Air; Other; Music; Science & Tech; Fashion",4.4,10,0
5:00 AM-10:00 PM,5:00 AM-10:00 PM,5:00 AM-10:00 PM,5:00 AM-10:00 PM,5:00 AM-9:00 PM,6:00 AM-8:00 PM,6:00 AM-8:00 PM,US/Eastern,71,"Business; Science & Tech; Performing & Visual Arts; Auto, Boat & Air; Other; Hobbies; Fashion; Travel & Outdoor; School Activities; Home & Lifestyle; Charity & Causes; Health; Sports & Fitness",3.7,10,3906
Open 24 Hours,Open 24 Hours,Open 24 Hours,Open 24 Hours,Open 24 Hours,Open 24 Hours,Open 24 Hours,US/Eastern,72,"Government; Holidays; Music; Home & Lifestyle; Auto, Boat & Air; Fashion; Hobbies; Charity & Causes; Sports & Fitness; Travel & Outdoor; Business; School Activities; Community; Film & Media; Performing & Visual Arts; Health; Food & Drink; Science & Tech; Other",9.7,10,351
5:00 AM-10:00 PM,5:00 AM-10:00 PM,5:00 AM-10:00 PM,5:00 AM-10:00 PM,5:00 AM-9:00 PM,6:00 AM-8:00 PM,6:00 AM-8:00 PM,US/Eastern,73,"Auto, Boat & Air; Travel & Outdoor",8.5,10,3217
5:00 AM-10:00 PM,5:00 AM-10:00 PM,5:00 AM-10:00 PM,5:00 AM-10:00 PM,5:00 AM-9:00 PM,6:00 AM-8:00 PM,6:00 AM-8:00 PM,US/Eastern,74,"Government; Food & Drink; Health; Sports & Fitness; Auto, Boat & Air; Charity & Causes; Fashion; Hobbies; Business",4.6,5,968
5:00 AM-10:00 PM,5:00 AM-10:00 PM,5:00 AM-10:00 PM,5:00 AM-10:00 PM,5:00 AM-9:00 PM,6:00 AM-8:00 PM,6:00 AM-8:00 PM,US/Eastern,75,Business; Spirituality; Community; Fashion; Government; Travel & Outdoor; Other; Charity & Causes; Music; Food & Drink; School Activities; Sports & Fitness; Health; Film & Media; Performing & Visual Arts; Family & Education; Home & Lifestyle; Science & Tech; Hobbies; Holidays,8.9,10,267
Open 24 Hours,Open 24 Hours,Open 24 Hours,Open 24 Hours,Open 24 Hours,Open 24 Hours,Open 24 Hours,US/Eastern,76,"Business; Auto, Boat & Air; Travel & Outdoor; School Activities; Charity & Causes; Performing & Visual Arts; Government; Science & Tech; Health; Home & Lifestyle",10.0,10,245
5:00 AM-10:00 PM,5:00 AM-10:00 PM,5:00 AM-10:00 PM,5:00 AM-10:00 PM,5:00 AM-9:00 PM,6:00 AM-8:00 PM,6:00 AM-8:00 PM,US/Eastern,77,Sports & Fitness; Performing & Visual Arts; Holidays; Home & Lifestyle; Music; Film & Media; School Activities; Government; Hobbies; Science & Tech; Business; Travel & Outdoor,4.9,5,262
Open 24 Hours,Open 24 Hours,Open 24 Hours,Open 24 Hours,Open 24 Hours,Open 24 Hours,Open 24 Hours,US/Eastern,78,,9.1,10,1505
Open 24 Hours,Open 24 Hours,Open 24 Hours,Open 24 Hours,Open 24 Hours,Open 24 Hours,Open 24 Hours,US/Eastern,79,Fashion; Other; School Activities; Music; Hobbies; Spirituality; Travel & Outdoor; Sports & Fitness; Community; Charity & Causes; Performing & Visual Arts,9.4,10,172
5:00 AM-10:00 PM,5:00 AM-10:00 PM,5:00 AM-10:00 PM,5:00 AM-10:00 PM,5:00 AM-9:00 PM,6:00 AM-8:00 PM,6:00 AM-8:00 PM,US/Eastern,80,"Music; Science & Tech; Hobbies; Spirituality; Auto, Boat & Air; Government; Travel & Outdoor",9.0,10,1354
Open 24 Hours,Open 24 Hours,Open 24 Hours,Open 24 Hours,Open 24 Hours,Open 24 Hours,Open 24 Hours,US/Eastern,81,"Science & Tech; Fashion; Business; Hobbies; Auto, Boat & Air",9.9,10,1927
5:00 AM-11:00 PM,5:00 AM-11:00 PM,5:00 AM-11:00 PM,5:00 AM-11:00 PM,5:00 AM-11:00 PM,5:00 AM-11:00 PM,5:00 AM-11:00 PM,US/Eastern,82,"Science & Tech; Auto, Boat & Air; Sports & Fitness; Health; Fashion; Family & Education",9.9,10,2315
5:00 AM-10:00 PM,5:00 AM-10:00 PM,5:00 AM-10:00 PM,5:00 AM-10:00 PM,5:00 AM-9:00 PM,6:00 AM-8:00 PM,6:00 AM-8:00 PM,US/Eastern,83,"Sports & Fitness; Spirituality; Home & Lifestyle; Fashion; Travel & Outdoor; Health; Auto, Boat & Air; Performing & Visual Arts; Community; Hobbies; Family & Education; Other; Science & Tech",3.2,5,1703
5:00 AM-10:00 PM,5:00 AM-10:00 PM,5:00 AM-10:00 PM,5:00 AM-10:00 PM,5:00 AM-9:00 PM,6:00 AM-8:00 PM,6:00 AM-8:00 PM,US/Eastern,84,"Health; Community; Spirituality; Science & Tech; Auto, Boat & Air; Performing & Visual Arts; Other; Home & Lifestyle; Fashion; Music; Government; Family & Education; School Activities; Travel & Outdoor; Film & Media; Hobbies; Sports & Fitness; Holidays; Food & Drink; Charity & Causes; Business",9.8,10,1913
5:00 AM-10:00 PM,5:00 AM-10:00 PM,5:00 AM-10:00 PM,5:00 AM-10:00 PM,5:00 AM-9:00 PM,6:00 AM-8:00 PM,6:00 AM-8:00 PM,US/Eastern,85,Travel & Outdoor; Community; Family & Education; School Activities; Charity & Causes; Home & Lifestyle; Spirituality; Hobbies; Health,8.7,10,382
Open 24 Hours,Open 24 Hours,Open 24 Hours,Open 24 Hours,Open 24 Hours,Open 24 Hours,Open 24 Hours,US/Eastern,86,Performing & Visual Arts; School Activities; Spirituality; Holidays; Community; Travel & Outdoor; Film & Media,9.4,10,471
Open 24 Hours,Open 24 Hours,Open 24 Hours,Open 24 Hours,Open 24 Hours,Open 24 Hours,Open 24 Hours,US/Eastern,87,"Business; Other; Performing & Visual Arts; Community; Auto, Boat & Air; School Activities; Government; Food & Drink; Film & Media; Spirituality; Fashion; Science & Tech; Travel & Outdoor; Music; Hobbies; Health; Family & Education; Home & Lifestyle; Charity & Causes; Holidays; Sports & Fitness",9.5,10,214
5:00 AM-10:00 PM,5:00 AM-10:00 PM,5:00 AM-10:00 PM,5:00 AM-10:00 PM,5:00 AM-9:00 PM,6:00 AM-8:00 PM,6:00 AM-8:00 PM,US/Eastern,88,Hobbies; School Activities; Spirituality,4.5,5,1967
5:00 AM-10:00 PM,5:00 AM-10:00 PM,5:00 AM-10:00 PM,5:00 AM-10:00 PM,5:00 AM-9:00 PM,6:00 AM-8:00 PM,6:00 AM-8:00 PM,US/Eastern,89,"Fashion; Food & Drink; Performing & Visual Arts; Charity & Causes; Spirituality; Music; Hobbies; Home & Lifestyle; Community; Business; Other; Sports & Fitness; Auto, Boat & Air",8.9,10,367
